{"$schema":"https://json-schema.org/draft/2020-12/schema","$id":"https://gist.local/contracts/registry/v1/binding.schema.json","type":"object","additionalProperties":false,"required":["id","version","capability_ref","tool_ref","provider_ref","adapter_version","fixture_digest","conformance","exact_versions"],"properties":{"id":{"type":"string"},"version":{"type":"string"},"capability_ref":{"type":"string"},"tool_ref":{"type":"string"},"provider_ref":{"type":"string"},"adapter_version":{"type":"string"},"fixture_digest":{"$ref":"https://gist.local/contracts/registry/v1/common.schema.json#/$defs/digest"},"conformance":{"enum":["passed","failed"]},"exact_versions":{"const":true}}}
