[{"id":"gist/composio/identity-user-create","version":"1.0.0","capability_ref":"gist/identity/user.create@1.0.0","tool_ref":"composio/identity-user-create@2026-09-25","provider_ref":"composio","adapter_version":"catalog-adapter-1.0.0","fixture_digest":{"algorithm":"sha256","value":"d7959f09635b728ea58ad3dd0b3d0a11026ba65eb3a9eed57df21b3d03978287"},"conformance":"passed","exact_versions":true},{"id":"gist/github-mcp-server/communication-message-send","version":"1.0.0","capability_ref":"gist/communication/message.send@1.0.0","tool_ref":"github-mcp-server/communication-message-send@0.1.0","provider_ref":"github-mcp-server","adapter_version":"catalog-adapter-1.0.0","fixture_digest":{"algorithm":"sha256","value":"b3429ca94a658a87e7bf9d8421478eb15e92d2bd079bf4bc84ff69c7e6b6fb52"},"conformance":"passed","exact_versions":true},{"id":"gist/slack-web-api/document-parse","version":"1.0.0","capability_ref":"gist/document/parse@1.0.0","tool_ref":"slack-web-api/document-parse@2026-09-25","provider_ref":"slack-web-api","adapter_version":"catalog-adapter-1.0.0","fixture_digest":{"algorithm":"sha256","value":"b67e3c0c0b4235949f5b38af23b15f8902b571d05c16b39ffc173e71d322f510"},"conformance":"passed","exact_versions":true}]
